{
  "schema_version": "1.0",
  "timestep_hours": 1,
  "timezone": "Asia/Shanghai",
  "timestamp_semantics": "interval_end",
  "forcing_unit": "mm/step",
  "warmup_steps": 1,
  "simulation_start": "2020-01-01T02:00:00+08:00",
  "simulation_end": "2020-01-01T05:00:00+08:00",
  "water_balance_tolerance_m": 1e-8,
  "parameters": {
    "qs0": 1e-7,
    "lnTe": -8.0,
    "m": 0.05,
    "Sr0": 0.03,
    "Srmax": 0.1,
    "td": 5.0,
    "vch": 1000.0,
    "vr": 100.0,
    "infiltration_excess": false
  }
}
